journal_short,issn,year,journal,title,authors,doi,url,abstract,type,issue,volume,score,is_referenced_by_count
,0022-3808,2024,Journal of Political Economy,The Human Capital–Reproductive Capital Trade-Off in Marriage Market Matching,"Low, Corinne",10.1086/726238,https://doi.org/10.1086/726238,,journal-article,2,132,13.335988,19
,0034-6527,2021,The Review of Economic Studies,Entrepreneurial Human Capital and Firm Dynamics,"Queiró, Francisco",10.1093/restud/rdab070,https://doi.org/10.1093/restud/rdab070,"<jats:title>Abstract</jats:title>
               <jats:p>This article shows that entrepreneurial human capital is a key driver of firm dynamics using administrative panel data on the universe of firms and workers in Portugal. Firms started by more educated entrepreneurs are larger at entry and exhibit higher life cycle growth. Consistent with an effect on growth, the thickness of the right tail of the size distribution increases with entrepreneur schooling. The evidence points to several underlying mechanisms, with technology adoption playing the most important part. I develop and estimate a model of firm dynamics that can parsimoniously account for these findings and use it to draw aggregate implications. Accounting for the effect of entrepreneurial human capital on firm dynamics can substantially increase aggregate returns to schooling and the fraction of cross-country income differences explained by human and physical capital.</jats:p>",journal-article,4,89,12.30193,29
,0033-5533,2024,The Quarterly Journal of Economics,Cognitive Endurance as Human Capital,"Brown, Christina; Kaur, Supreet; Kingdon, Geeta; Schofield, Heather",10.1093/qje/qjae043,https://doi.org/10.1093/qje/qjae043,"<jats:title>Abstract</jats:title>
               <jats:p>Schooling may build human capital not only by teaching academic skills but by expanding the capacity for cognition. We focus specifically on cognitive endurance: the ability to sustain effortful mental activity over a continuous stretch of time. As motivation, we document that globally and in the United States, the poor exhibit cognitive fatigue more quickly than the rich do across field settings; they also attend schools that offer fewer opportunities to practice thinking for continuous stretches. Using a field experiment with 1,600 Indian primary school students, we randomly increase the amount of time students spend in sustained cognitive activity during the school day—using either math problems (mimicking good schooling) or nonacademic games (providing a pure test of our mechanism). Each approach markedly improves cognitive endurance: students show 22% less decline in performance over time when engaged in intellectual activities—listening comprehension, academic problems, or IQ tests. They also exhibit increased attentiveness in the classroom and score higher on psychological measures of sustained attention. Moreover, each treatment improves students’ school performance by 0.09 standard deviations. This indicates that the experience of effortful thinking itself—even when devoid of any subject content—improves general cognitive capacity. Finally, we complement these results with quasi-experimental variation indicating that an additional year of schooling improves cognitive endurance, but only in higher-quality schools. Our findings suggest that schooling disparities may further disadvantage poor children by hampering the development of a core mental capacity.</jats:p>",journal-article,2,140,11.551212,3
,0002-8282,2021,American Economic Review,Team-Specific Human Capital and Team Performance: Evidence from Doctors,"Chen, Yiqun",10.1257/aer.20201238,https://doi.org/10.1257/aer.20201238,"<jats:p> This paper studies whether team members’ past collaboration creates team-specific human capital and influences current team performance. Using administrative Medicare claims for two heart procedures, I find that shared work experience between the doctor who performs the procedure (“proceduralist”) and the doctors who provide care to the patient during the hospital stay for the procedure (“physicians”) reduces patient mortality rates. A one standard deviation increase in proceduralist-physician shared work experience leads to a 10–14 percent reduction in patient 30-day mortality. Patient medical resource use also declines with shared work experience, even as survival improves. (JEL I10, J24, M12, M54) </jats:p>",journal-article,12,111,11.423721,35
,0002-8282,2022,American Economic Review,Human Capital Depreciation and Returns to Experience,"Dinerstein, Michael; Megalokonomou, Rigissa; Yannelis, Constantine",10.1257/aer.20201571,https://doi.org/10.1257/aer.20201571,"<jats:p> Human capital can depreciate if skills are unused. But estimating human capital depreciation is challenging, as worker skills are difficult to measure and less productive workers are more likely to spend time in nonemployment. We overcome these challenges with new administrative data on teachers’ assignments and their students’ outcomes, and quasi-random variation from the teacher assignment process in Greece. We find significant losses to output, as a one-year increase in time without formal employment lowers students’ test scores by 0.05 standard deviations. Using a simple production model, we estimate a skill depreciation rate of 4.3 percent and experience returns of 6.8 percent. (JEL I21, J24, J45, J64, J65) </jats:p>",journal-article,11,112,11.298618,55
,0002-8282,2021,American Economic Review,"Dynastic Human Capital, Inequality, and Intergenerational Mobility","Adermon, Adrian; Lindahl, Mikael; Palme, Mårten",10.1257/aer.20190553,https://doi.org/10.1257/aer.20190553,"<jats:p>We estimate long-run intergenerational persistence in human capital using information on outcomes for the extended family: the dynasty. A dataset including the entire Swedish population, linking four generations, allows us to identify parents’ siblings and cousins, their spouses, and spouses’ siblings. Using various human capital measures, we show that traditional parent-child estimates underestimate long-run intergenerational persistence by at least one-third. By adding outcomes for more distant ancestors, we show that almost all of the persistence is captured by the parental generation. Data on adoptees show that at least one- third of long-term persistence is attributed to environmental factors. (JEL I24, I26, J12, J24, J62)</jats:p>",journal-article,5,111,11.294388,98
,0034-6527,2024,Review of Economic Studies,On the Family Origins of Human Capital Formation: Evidence from Donor Children,"Lundborg, Petter; Plug, Erik; Rasmussen, Astrid Würtz",10.1093/restud/rdae101,https://doi.org/10.1093/restud/rdae101,"<jats:title>Abstract</jats:title>
               <jats:p>We introduce a novel strategy to study the intergenerational transmission of human capital skills, net of genetic skill transfers. For this purpose, we use unique Danish data on children conceived through sperm and egg donation in in vitro fertilization treatments to estimate the relationship between child test scores and parental years of schooling. Because the assignment of donors is not selective, these parental schooling estimates allow for a causal nurture interpretation. Once we take account of genes, we find that only the education of mothers matters: the association between father’s education and child test scores (in reading and math) is insignificant and practically zero, whereas the association between mother’s education and child test scores (in reading, not in math) is significant and large, and as large as the association we estimate for mothers of non-donor children.</jats:p>",journal-article,5,92,10.872478,2
,0022-3808,2021,Journal of Political Economy,Human Capital Investments and Expectations about Career and Family,"Wiswall, Matthew; Zafar, Basit",10.1086/713100,https://doi.org/10.1086/713100,,journal-article,5,129,10.856478,109
,0022-3808,2021,Journal of Political Economy,Parent-Child Information Frictions and Human Capital Investment: Evidence from a Field Experiment,"Bergman, Peter",10.1086/711410,https://doi.org/10.1086/711410,,journal-article,1,129,10.673588,87
,0002-8282,2025,American Economic Review,Changing Tracks: Human Capital Investment after Loss of Ability,"Humlum, Anders; Munch, Jakob R.; Plato, Pernille",10.1257/aer.20231067,https://doi.org/10.1257/aer.20231067,"<jats:p> We provide the first evidence on how workers invest in human capital after losing ability. Using quasi-random work accidents in Danish administrative data, we find that workers enroll in bachelor’s programs after physical injuries, pursuing degrees that build on their past training and experience. Exploiting institutional differences in the stackability of degrees, we find that higher education moves injured workers from disability benefits to full-time employment, earning 25 percent more than before injury. Reskilling subsidies for injured workers pay for themselves four times over, and current rates of reskilling are substantially below the social optimum, especially for middle-aged workers. (JEL I26, J14, J24, J62) </jats:p>",journal-article,5,115,10.665789,5
,0022-3808,2024,Journal of Political Economy,Careers in Firms: The Role of Learning about Ability and Human Capital Acquisition,"Pastorino, Elena",10.1086/728454,https://doi.org/10.1086/728454,,journal-article,6,132,10.647745,19
,0002-8282,2024,American Economic Review,Opportunity Unraveled: Private Information and the Missing Markets for Financing Human Capital,"Herbst, Daniel; Hendren, Nathaniel",10.1257/aer.20211653,https://doi.org/10.1257/aer.20211653,"<jats:p> We examine whether adverse selection has unraveled private markets for equity and state-contingent debt contracts for financing higher education. Using survey data on beliefs, we show a typical college-goer would have to repay $1.64 in present value for every $1 of financing to overcome adverse selection in an equity market. We find that risk-averse college-goers are not willing to accept these terms, so markets unravel. We discuss why moral hazard, biased beliefs, and outside credit options are less likely to explain the absence of these markets. We quantify the welfare gains for subsidizing equity-like contracts that mitigate college-going risks. (JEL D82, D83, G51, I22, I23, I26, J24) </jats:p>",journal-article,7,114,10.610857,4
,0022-3808,2025,Journal of Political Economy,Enhancing Human Capital in Children: A Case Study on Scaling,"Agostinelli, Francesco; Avitabile, Ciro; Bobba, Matteo",10.1086/732886,https://doi.org/10.1086/732886,,journal-article,2,133,10.528931,5
,0002-8282,2023,American Economic Review,The (Lack of) Anticipatory Effects of the Social Safety Net on Human Capital Investment,"Deshpande, Manasi; Dizon-Ross, Rebecca",10.1257/aer.20230010,https://doi.org/10.1257/aer.20230010,"<jats:p>How does the expectation that a child will receive government benefits in adulthood affect parental investments in the child’s human capital? Most parents whose children receive Supplemental Security Income (SSI) benefits overestimate the likelihood that their child will receive SSI benefits in adulthood. We present randomly selected families with the predicted likelihood that their child will receive SSI benefits in adulthood. Reducing parents’ expectations that children will receive benefits in adulthood does not increase investments in children’s human capital. This zero effect is precisely estimated. Likely explanations include parents working more themselves, nonfinancial goals influencing investment, and families facing investment constraints. (JEL G52, I26, I38, J13, J24, J31)</jats:p>",journal-article,12,113,10.5207615,13
,0034-6527,2022,The Review of Economic Studies,"The Dynamics of Return Migration, Human Capital Accumulation, and Wage Assimilation","Adda, Jérôme; Dustmann, Christian; Görlach, Joseph-Simon",10.1093/restud/rdac003,https://doi.org/10.1093/restud/rdac003,"<jats:title>Abstract</jats:title>
               <jats:p>This article develops and estimates a dynamic model where individuals differ in ability and location preference to evaluate the mechanisms that affect the evolution of immigrants’ careers in conjunction with their re-migration plans. Our analysis highlights a novel form of selective return migration where those who plan to stay longer invest more into skill acquisition, with important implications for the assessment of immigrants’ career paths and the estimation of their earnings profiles. Our study also explains the willingness of immigrants to accept jobs at wages that seem unacceptable to natives. Finally, our model provides important insight for the design of migration policies, showing that policies that initially restrict residence or condition residence on achievement shape not only immigrants’ career profiles through their impact on human capital investment but also determine the selection of arrivals and leavers.</jats:p>",journal-article,6,89,10.185169,75
,0034-6527,2025,Review of Economic Studies,Trauma at School: The Impacts of Shootings on Students’ Human Capital and Economic Outcomes,"Cabral, Marika; Kim, Bokyung; Rossin-Slater, Maya; Schnell, Molly; Schwandt, Hannes",10.1093/restud/rdaf027,https://doi.org/10.1093/restud/rdaf027,"<jats:title>Abstract</jats:title>
                  <jats:p>We examine how shootings at schools—an increasingly common form of gun violence in the States—impact the educational and economic trajectories of students. Using linked schooling and labor market data in Texas from 1992 to 2018, we compare within-student and across-cohort changes in outcomes following a shooting to those experienced by students at matched control schools. We find that school shootings increase absenteeism and grade repetition, reduce high school graduation, college enrollment, and college completion; and reduce employment and earnings at ages 24–26 years. We further find school-level increases in the number of leadership staff and reductions in retention among teachers and teaching support staff in the years following a shooting. The adverse impacts of shootings span student characteristics, suggesting that the economic costs of school shootings are universal.</jats:p>",journal-article,1,93,10.179352,1
,0002-8282,2022,American Economic Review,Who Set Your Wage?,"Card, David",10.1257/aer.112.4.1075,https://doi.org/10.1257/aer.112.4.1075,"<jats:p> I discuss the recent literature that has led to new interest in the idea of monopsonistic wage setting. Building on advances in search theory and in models of differentiated products, researchers have used a number of different strategies to identify the elasticity of firm-specific labor supply. A growing consensus is that firms have some wage-setting power, though many questions remain about the sources of that power. (JEL B21, D21, D24, D43, J22, J31, J42) </jats:p>",journal-article,4,112,10.171473,122
,0034-6527,2023,Review of Economic Studies,The Cost of Wage Rigidity,"Faia, Ester; Pezone, Vincenzo",10.1093/restud/rdad020,https://doi.org/10.1093/restud/rdad020,"<jats:title>Abstract</jats:title>
               <jats:p>Private efficiency of wage rigidity has taken centre stage in economics. Measuring its effects has proven elusive for lack of actual wage data. Using a unique confidential labour contract-level dataset matched with firm-level high-frequency asset prices, we find robust evidence that firms’ stock prices and employment fluctuate more in response to monetary policy announcements, the higher the degree of wage rigidity. Hand-collected information on the periods across renegotiations of collective bargaining agreements allow us to construct an accurate and predetermined measure of wage rigidity. We find that the amplification induced by wage rigidity is stronger for firms with high labour intensity, low profitability, and a large share of workers with more rigid contracts.</jats:p>",journal-article,1,91,10.162372,21
,0034-6527,2025,Review of Economic Studies,Life-Cycle Wages and Human Capital Investments: Selection and Missing Data,"Gobillon, Laurent; Magnac, Thierry; Roux, Sébastien",10.1093/restud/rdaf099,https://doi.org/10.1093/restud/rdaf099,"<jats:title>Abstract</jats:title>
                  <jats:p>We derive wage equations with individual-specific coefficients from a structural model of human capital investment over the life-cycle. This model allows for interruptions in labour market participation and deals with missing data and attrition problems. We propose a new framework that deals with missingness at random and is based on factor decompositions that allow for flexible control of selection. Our approach leads to an interactive effect wage specification, which we estimate using long administrative panel data on male wages in the private sector in France. A structural function approach shows that interruptions negatively affect average wages. Interestingly, they also negatively affect the inter-decile range of wages after twenty years. This is only partly due to the fact that interruptions are endogenous.</jats:p>",journal-article,,,10.091691,0
,0012-9682,2022,Econometrica,"Tasks, Automation, and the Rise in U.S. Wage Inequality","Acemoglu, Daron; Restrepo, Pascual",10.3982/ecta19815,https://doi.org/10.3982/ecta19815,"<jats:p>We document that between 50% and 70% of changes in the U.S. wage structure over the last four decades are accounted for by relative wage declines of worker groups specialized in routine tasks in industries experiencing rapid automation. We develop a conceptual framework where tasks across industries are allocated to different types of labor and capital. Automation technologies expand the set of tasks performed by capital, displacing certain worker groups from jobs for which they have comparative advantage. This framework yields a simple equation linking wage changes of a demographic group to the 
            <jats:italic>task displacement</jats:italic> it experiences. We report robust evidence in favor of this relationship and show that regression models incorporating task displacement explain much of the changes in education wage differentials between 1980 and 2016. The negative relationship between wage changes and task displacement is unaffected when we control for changes in market power, deunionization, and other forms of capital deepening and technology unrelated to automation. We also propose a methodology for evaluating the full general equilibrium effects of automation, which incorporate induced changes in industry composition and ripple effects due to task reallocation across different groups. Our quantitative evaluation explains how major changes in wage inequality can go hand‐in‐hand with modest productivity gains.
          </jats:p>",journal-article,5,90,9.969544,469
,0002-8282,2021,American Economic Review,Prep School for Poor Kids: The Long-Run Impacts of Head Start on Human Capital and Economic Self-Sufficiency,"Bailey, Martha J.; Sun, Shuqiao; Timpe, Brenden",10.1257/aer.20181801,https://doi.org/10.1257/aer.20181801,"<jats:p> This paper evaluates the long-run effects of Head Start using large-scale, restricted administrative data. Using the county roll-out of Head Start between 1965 and 1980 and age-eligibility cutoffs for school entry, we find that Head Start generated large increases in adult human capital and economic self-sufficiency, including a 0. 65-year increase in schooling, a 2.7 percent increase in high school completion, an 8.5 percent increase in college enrollment, and a 39 percent increase in college completion. These estimates imply sizable, long-term returns to investments in means-tested, public preschool programs. (JEL I21, I26, I28, I38, J24) </jats:p>",journal-article,12,111,9.900397,89
,0002-8282,2021,American Economic Review,The Impacts of a Multifaceted Prenatal Intervention on Human Capital Accumulation in Early Life,"Carneiro, Pedro; Kraftman, Lucy; Mason, Giacomo; Moore, Lucie; Rasul, Imran; Scott, Molly",10.1257/aer.20191726,https://doi.org/10.1257/aer.20191726,"<jats:p>We evaluate an intervention targeting early life nutrition and well-being for households in extreme poverty in Northern Nigeria. The intervention leads to large and sustained improvements in children’s anthropometric and health outcomes, including an 8 percent reduction in stunting 4 years, post-intervention. These impacts are partly driven by information-related channels. However, the certain and substantial flow of cash transfers is also key. They induce positive labor supply responses among women, and enables them to undertake productive investments in livestock. These provide protein rich diets for children, and generate higher household earnings streams long after the cash transfers expire. (JEL I12, I32, I38, J13, J16, J22, O12)</jats:p>",journal-article,8,111,9.8331,49
,0033-5533,2025,The Quarterly Journal of Economics,"The Race Between Education, Technology, and the Minimum Wage","Vogel, Jonathan",10.1093/qje/qjaf014,https://doi.org/10.1093/qje/qjaf014,"<jats:title>ABSTRACT</jats:title>
               <jats:p>What is the effect of the real minimum wage on wages and inequality? I develop a theory that nests the race between education and technology. The theory predicts that the effect of changes in minimum wages is initially small but grows over time. I present empirical evidence of these dynamic effects: the elasticity of real wages grows substantially over a three-year period. I show that minimum wages help rationalize a considerable decline in real wages of low-education workers in the 1980s and play a role in shaping the evolution of the U.S. college premium.</jats:p>",journal-article,3,140,9.771343,2
,0034-6527,2021,The Review of Economic Studies,An Elementary Theory of Directed Technical Change and Wage Inequality,"Loebbing, Jonas",10.1093/restud/rdab025,https://doi.org/10.1093/restud/rdab025,"<jats:title>Abstract</jats:title><jats:p>This article generalizes central results from the theory of (endogenously) directed technical change to settings where technology does not take a labour-augmenting form and with arbitrarily many levels of skill. Building on simple notions of complementarity, the results remain intuitive despite their generality. The developed theory allows to study the endogenous determination of labour-replacing, that is, automation technology through the lens of directed technical change theory. In an assignment model with a continuum of differentially skilled workers and capital, where capital perfectly substitutes for labour in the production of tasks, any increase in the relative supply of skilled workers stimulates investment into improving the productivity of capital, potentially leading skill premia to increase in relative skill supply. Relatedly, trade with a skill-scarce country discourages improvements in capital productivity, potentially reversing the standard Heckscher–Ohlin effects.</jats:p>",journal-article,1,89,9.713316,10
,0012-9682,2024,Econometrica,Walras–Bowley Lecture: Market Power and Wage Inequality,"Deb, Shubhdeep; Eeckhout, Jan; Patel, Aseem; Warren, Lawrence",10.3982/ecta21157,https://doi.org/10.3982/ecta21157,"<jats:p>We propose a theory of how market power affects wage inequality. We ask how goods and labor market power jointly determine the level of wages, the skill premium, and wage inequality. We then use detailed microdata from the U.S. Census Bureau between 1997 and 2016 to estimate the parameters of labor supply, technology, and the market structure. We find that a less competitive market structure lowers the average wage of high‐skilled workers by 11.3%, and of low‐skilled workers by 12.2%, contributes 8.1% to the rise in the skill premium, and accounts for 54.8% of the increase in between‐establishment wage variance.</jats:p>",journal-article,3,92,9.627222,19
,0022-3808,2023,Journal of Political Economy,Sources of Wage Growth,"Adda, Jérôme; Dustmann, Christian",10.1086/721657,https://doi.org/10.1086/721657,,journal-article,2,131,9.412397,34
,0034-6527,2024,Review of Economic Studies,Correction to: The U.K. as a Technological Follower: Higher Education Expansion and the College Wage Premium,,10.1093/restud/rdae029,https://doi.org/10.1093/restud/rdae029,,journal-article,4,91,9.3594675,1
,0034-6527,2024,Review of Economic Studies,Wage Risk and Government and Spousal Insurance,"De Nardi, Mariacristina; Fella, Giulio; Paz-Pardo, Gonzalo",10.1093/restud/rdae042,https://doi.org/10.1093/restud/rdae042,"<jats:title>Abstract</jats:title>
               <jats:p>The extent to which households can self-insure depends on family structure and wage risk. We calibrate a model of couples and singles’ savings and labour supply under two types of wage processes. The first wage process is the canonical—age-independent, linear—one that is typically used to evaluate government insurance provision. The second wage process is a flexible one. We use our model to evaluate the optimal mix of the two most common types of means-tested benefits—IW versus income floor. The canonical wage process underestimates wage persistence for women and thus implies that IW benefits should account for most benefit income. In contrast, the richer wage process that matches the wage data well, implies that the income floor should be the main benefit source, similarly to the system in place in the U.K. This stresses that allowing for rich wage dynamics is important to properly evaluate policy.</jats:p>",journal-article,2,92,9.3209915,3
