journal_short,issn,year,journal,title,authors,doi,url,abstract,type,issue,volume,score,is_referenced_by_count
,0022-3808,2024,Journal of Political Economy,"Estimation of a Life-Cycle Model with Human Capital, Labor Supply, and Retirement","Fan, Xiaodong; Seshadri, Ananth; Taber, Christopher",10.1086/726232,https://doi.org/10.1086/726232,,journal-article,1,132,6.5313387,15
,0033-5533,2025,The Quarterly Journal of Economics,Digital Distractions with Peer Influence: The Impact of Mobile App Usage on Academic and Labor Market Outcomes,"Barwick, Panle Jia; Chen, Siyu; Fu, Chao; Li, Teng",10.1093/qje/qjaf048,https://doi.org/10.1093/qje/qjaf048,"<jats:title>Abstract</jats:title>
                  <jats:p>Concerns about excessive mobile phone use among youth are mounting. We present estimates of behavioral and contextual peer effects, along with comprehensive evidence on how students’ own and their peers’ app usage affect academic performance, physical health, and labor market outcomes. Our analysis draws on administrative data from a Chinese university covering three student cohorts over four years. We exploit random roommate assignments, differential exposure to a policy shock (gaming restrictions for minors), and differential exposure to a discrete event (the introduction of a blockbuster video game) for identification. App usage is contagious: a one s.d. increase in roommates’ in-college app usage raises own usage by 5.8%. High app usage is harmful across all measured outcomes. A one s.d. increase in app usage reduces GPAs by 36.2% of a within-cohort-major s.d. and lowers wages by 2.3%. Roommates’ app usage reduces a student’s GPA and wages through both disruptions and behavioral spillovers, generating a total negative effect that exceeds half the magnitude of the impact from the student’s own app usage. Extending China’s three-hour-per-week gaming restriction for minors to college students would boost their initial wages by 0.9%. High-frequency GPS and app usage data show that heavy app users spend less time in study halls, are more frequently late or absent from class, and get less sleep.</jats:p>",journal-article,1,141,6.505911,4
,0022-3808,2024,Journal of Political Economy,The Supply-Side Effects of Monetary Policy,"Baqaee, David R.; Farhi, Emmanuel; Sangani, Kunal",10.1086/727287,https://doi.org/10.1086/727287,,journal-article,4,132,6.501991,41
,0002-8282,2025,American Economic Review,Micro versus Macro Labor Supply Elasticities: The Role of Dynamic Returns to Effort,"Kleven, Henrik; Kreiner, Claus; Larsen, Kristian; Søgaard, Jakob",10.1257/aer.20240554,https://doi.org/10.1257/aer.20240554,"<jats:p> We investigate long-run earnings responses to taxes in the presence of dynamic returns to effort. First, we develop a theoretical model of earnings determination with dynamic returns to effort. In this model, earnings responses are delayed and mediated by job switches. Second, using administrative data from Denmark, we verify our model's predictions about earnings and hours-worked patterns over the life cycle. Third, we provide a quasi-experimental analysis of long-run earnings elasticities. Informed by our model, the empirical strategy exploits variation among job switchers. We find that the long-run elasticity is around 0.5, considerably larger than the short-run elasticity of roughly 0.2. (JEL D31, H24, H31, J22, J31, J62) </jats:p>",journal-article,9,115,6.4927664,5
,0022-3808,2021,Journal of Political Economy,The Impact of Temperature on Productivity and Labor Supply: Evidence from Indian Manufacturing,"Somanathan, E.; Somanathan, Rohini; Sudarshan, Anant; Tewari, Meenu",10.1086/713733,https://doi.org/10.1086/713733,,journal-article,6,129,6.4927664,523
,0002-8282,2023,American Economic Review,Who Benefits from State Corporate Tax Cuts? A Local Labor Market Approach with Heterogeneous Firms: Reply,"Suárez Serrato, Juan Carlos; Zidar, Owen",10.1257/aer.20230208,https://doi.org/10.1257/aer.20230208,"<jats:p> In Suárez Serrato and Zidar (2016), we estimate the incidence of state corporate taxes. Malgouyres, Mayer, and Mazet-Sonilhac (2023) highlight two errors, ignoring effects on firm composition and characterizing capital costs inconsistently. This reply corrects the structural model and corresponding incidence estimates. The incidence results are similar to the originally reported estimates and the confidence intervals widen for some estimates. In the corrected structural model, the firm owner incidence share estimate changes by 1.6 percentage points relative to the original version (i.e., 38.1 percent versus 36.5 percent). The worker share estimate is 35.0 percent. Landowners bear the remaining 26.8 percent. (JEL H22, H25, H32, H71, R23, R51) </jats:p>",journal-article,12,113,6.4615235,7
,0002-8282,2022,American Economic Review,Does Race Matter for Police Use of Force? Evidence from 911 Calls,"Hoekstra, Mark; Sloan, CarlyWill",10.1257/aer.20201292,https://doi.org/10.1257/aer.20201292,"<jats:p> This paper examines race and police use of force using data on 1.6 million 911 calls in two cities, neither of which allows for discretion in officer dispatch. Results indicate White officers increase force much more than minority officers when dispatched to more minority neighborhoods. Estimates indicate Black (Hispanic) civilians are 55 (75) percent more likely to experience any force, and five times as likely to experience a police shooting, compared to if White officers scaled up force similarly to minority officers. Additionally, 14 percent of White officers use excess force in Black neighborhoods relative to our statistical benchmark. (JEL H76, J15, K42, R23) </jats:p>",journal-article,3,112,6.436716,104
,0002-8282,2023,American Economic Review,Who Benefits from State Corporate Tax Cuts? A Local Labor Markets Approach with Heterogeneous Firms: Comment,"Malgouyres, Clément; Mayer, Thierry; Mazet-Sonilhac, Clément",10.1257/aer.20201753,https://doi.org/10.1257/aer.20201753,"<jats:p> Suárez Serrato and Zidar (2016) identify state corporate tax incidence in a spatial equilibrium model with imperfectly mobile firms. Their identification argument rests on comparative statics omitting a channel implied by their model: the link between common determinants of a location’s attractiveness and the average idiosyncratic productivity of firms choosing that location. This compositional margin causes the labor demand elasticity to be independent from the product demand elasticity, impeding the identification of incidence from the four estimated reduced-form effects. Assigning consensual values to the unidentified parameters, we find that the incidence share borne by firm owners is closer to 25 percent than 40 percent. (JEL H22, H25, H32, H71, R23, R51) </jats:p>",journal-article,8,113,6.4247055,5
,0022-3808,2025,Journal of Political Economy,Labor Market Returns to Personality: A Job Search Approach to Understanding Gender Gaps,"Flinn, Christopher J.; Todd, Petra E.; Zhang, Weilong",10.1086/734092,https://doi.org/10.1086/734092,,journal-article,4,133,6.414877,10
,0033-5533,2025,The Quarterly Journal of Economics,Bargaining and Inequality in the Labor Market,"Caldwell, Sydnee; Haegele, Ingrid; Heining, Jörg",10.1093/qje/qjaf049,https://doi.org/10.1093/qje/qjaf049,"<jats:title>Abstract</jats:title>
                  <jats:p>We use novel surveys of firms and workers, linked to administrative employer-employee data, to study the prevalence and importance of individual bargaining in wage determination. We show that simple survey questions accurately elicit firms’ bargaining strategies. Using the elicited strategies for 772 German firms, we document that the majority of firms are willing to engage in individual wage bargaining. Labor market factors predict firms’ strategies better than firm characteristics. Survey responses from nearly 10,000 full-time workers indicate that most workers provide their salary expectations before they receive a job offer. Most outside offers are rejected, with the worker remaining at the incumbent firm. There is substantial heterogeneity in workers’ bargaining behavior, which translates into within-firm wage inequality. Firms that set pay via individual bargaining have a 3 percentage point higher gender wage gap.</jats:p>",journal-article,1,141,6.390921,4
,0022-3808,2024,Journal of Political Economy,"Foreign Debt, Capital Controls, and Secondary Markets: Theory and Evidence from Nazi Germany","Papadia, Andrea; Schioppa, Claudio A.",10.1086/728112,https://doi.org/10.1086/728112,,journal-article,6,132,6.3773336,2
,0002-8282,2023,American Economic Review,When a Doctor Falls from the Sky: The Impact of Easing Doctor Supply Constraints on Mortality,"Okeke, Edward N.",10.1257/aer.20210701,https://doi.org/10.1257/aer.20210701,"<jats:p>This paper describes the results of a policy experiment conducted in coordination with the Nigerian government. In this experiment, some communities were randomly selected to receive a new doctor. These doctors were posted to the local public health center. Prior to their arrival, health care was provided by midlevel health-care providers (MLP). To separate the effect of (ostensibly higher) quality from that of quantity, another group of communities was provided with an additional midlevel provider. A third group of communities received no additional workers. No other inputs were provided. I find a measurable decrease in mortality in communities assigned a doctor but not in communities assigned an MLP, suggesting that quality in the health-care sector is a significant constraint. (JEL I11, I12, O15, O18)</jats:p>",journal-article,3,113,6.377277,22
,0002-8282,2022,American Economic Review,Supply and Demand in Disaggregated Keynesian Economies with an Application to the COVID-19 Crisis,"Baqaee, David; Farhi, Emmanuel",10.1257/aer.20201229,https://doi.org/10.1257/aer.20201229,"<jats:p> We study supply and demand shocks in a disaggregated model with multiple sectors, multiple factors, input-output linkages, downward nominal wage rigidities, credit-constraints, and a zero lower bound. We use the model to understand how the COVID-19 crisis, an omnibus supply and demand shock, affects output, unemployment, and inflation, and leads to the coexistence of tight and slack labor markets. We show that negative sectoral supply shocks are stagflationary, whereas negative demand shocks are deflationary, even though both can cause Keynesian unemployment. Furthermore, complementarities in production amplify Keynesian spillovers from supply shocks but mitigate them for demand shocks. This means that complementarities reduce the effectiveness of aggregate demand stimulus. In a stylized quantitative model of the United States, we find supply and demand shocks each explain about one-half of the reduction in real GDP from February to May 2020. Although there was as much as 6 percent Keynesian unemployment, this was concentrated in certain markets. Hence, aggregate demand stimulus is one quarter as effective as in a typical recession where all labor markets are slack. (JEL E12, E23, E24, E31, E32, E62, I12) </jats:p>",journal-article,5,112,6.3677588,207
,0033-5533,2025,The Quarterly Journal of Economics,Voluntary Minimum Wages: The Local Labor Market Effects of National Retailer Policies,"Derenoncourt, Ellora; Weil, David",10.1093/qje/qjaf016,https://doi.org/10.1093/qje/qjaf016,"<jats:title>ABSTRACT</jats:title>
               <jats:p>Low unionization rates, a falling real federal minimum wage, and outsourcing have hampered wage growth in the low-wage sector in the United States for several decades. In recent years (2014–2023), a number of large private retailers—including some of the largest employers in the United States—have opted to institute or raise company-wide, voluntary minimum wages (VMWs) for their employees. We use anonymized payroll data from a large credit bureau and a major payroll provider to study the effects of these national retailer policies on adopting employers’ own wages and employment as well as their spillovers to other employers in shared local labor markets, variously defined. Using stacked event studies centered around multiple VMW events and a continuous treatment variable defined as the gap between local-area wages and the company minimum, we find that VMWs result in sizable wage increases and reductions in turnover at the companies that implement them. Turning to wages at other companies, we estimate small, often economically negligible, spillover effects across multiple measures of exposure to VMWs and numerous definitions of relevant competitors, including firms connected by worker flows. Together, the evidence points to little role for strategic interactions in the transmission of large retailers’ wage policies to other firms. Voluntary minimum wage policies have affected over 3 million jobs at adopting employers, yet their impact on the broader labor market is limited.</jats:p>",journal-article,3,140,6.332905,7
,0002-8282,2025,American Economic Review,Imperfect Competition and Rents in Labor and Product Markets: The Case of the Construction Industry,"Kroft, Kory; Luo, Yao; Mogstad, Magne; Setzler, Bradley",10.1257/aer.20220577,https://doi.org/10.1257/aer.20220577,"<jats:p> We develop, identify, and estimate a model of imperfect competition in both labor and product markets. Our context is the US construction industry, where firms compete for workers, private market projects, and government procurements. Our empirical approach leverages bidding data from procurement auctions linked to employer-employee tax records. We find imperfect competition in both markets generates a total wage markdown of more than 30 percent and a total price markup of around 45 percent. By contrast, if one erroneously assumed a perfectly competitive product (labor) market, then one would conclude wages (prices) are marked down (up) by only 20 percent (16 percent). (JEL D21, D24, H76, J31, L13, L74) </jats:p>",journal-article,9,115,6.32529,13
,0033-5533,2021,The Quarterly Journal of Economics,Redrawing the Map of Global Capital Flows: The Role of Cross-Border Financing and Tax Havens,"Coppola, Antonio; Maggiori, Matteo; Neiman, Brent; Schreger, Jesse",10.1093/qje/qjab014,https://doi.org/10.1093/qje/qjab014,"<jats:title>Abstract</jats:title><jats:p>Global firms finance themselves through foreign subsidiaries, often shell companies in tax havens, which obscures their true economic location in official statistics. We associate the universe of traded securities issued by firms in tax havens with their issuer's ultimate parent and restate bilateral investment positions to better reflect the financial linkages connecting countries around the world. Bilateral portfolio investment from developed countries to firms in large emerging markets is dramatically larger than previously thought. The national accounts of the United States, for example, understate the U.S. position in Chinese firms by nearly $600 billion. Further, we demonstrate how offshore issuance in tax havens affects our understanding of the currency composition of external portfolio liabilities and the nature of foreign direct investment. Finally, we provide additional restatements of bilateral investment positions, including one based on the geographic distribution of sales.</jats:p>",journal-article,3,136,6.3030205,203
,0002-8282,2022,American Economic Review,Macroeconomic Implications of COVID-19: Can Negative Supply Shocks Cause Demand Shortages?,"Guerrieri, Veronica; Lorenzoni, Guido; Straub, Ludwig; Werning, Iván",10.1257/aer.20201063,https://doi.org/10.1257/aer.20201063,"<jats:p> Motivated by the effects of the COVID-19 pandemic, we present a theory of Keynesian supply shocks: shocks that reduce potential output in a sector of the economy, but that, by reducing demand in other sectors, ultimately push aggregate activity below potential. A Keynesian supply shock is more likely when the elasticity of substitution between sectors is relatively low, the intertemporal elasticity of substitution is relatively high, and markets are incomplete. Fiscal policy can display a smaller multiplier, but the insurance benefit of fiscal transfers can be enhanced. Firm exits and job destruction can amplify and propagate the shock. (JEL D52, E23, E24, E32, E62, I12, I18) </jats:p>",journal-article,5,112,6.2989564,370
,0002-8282,2021,American Economic Review,On Her Own Account: How Strengthening Women’s Financial Control Impacts Labor Supply and Gender Norms,"Field, Erica; Pande, Rohini; Rigol, Natalia; Schaner, Simone; Troyer Moore, Charity",10.1257/aer.20200705,https://doi.org/10.1257/aer.20200705,"<jats:p> Can increasing control over earnings incentivize a woman to work, and thereby influence norms around gender roles? We randomly varied whether rural Indian women received bank accounts, training in account use, and direct deposit of public sector wages into their own (versus husbands’) accounts. Relative to the accounts only group, women who also received direct deposit and training worked more in public and private sector jobs. The private sector result suggests gender norms initially constrained female employment. Three years later, direct deposit and training broadly liberalized women’s own work-related norms, and shifted perceptions of community norms. (JEL G51, G53, J16, J31, O12, O16, Z13) </jats:p>",journal-article,7,111,6.2845902,217
,0022-3808,2023,Journal of Political Economy,Supply Chain Resilience: Should Policy Promote International Diversification or Reshoring?,"Grossman, Gene M.; Helpman, Elhanan; Lhuillier, Hugo",10.1086/725173,https://doi.org/10.1086/725173,,journal-article,12,131,6.266568,99
,0002-8282,2025,American Economic Review,Fiscal Policy and Credit Supply in a Crisis,"Bonfim, Diana; Ferreira, Miguel A.; Queiró, Francisco; Zhao, Sujiao (Emma)",10.1257/aer.20221499,https://doi.org/10.1257/aer.20221499,"<jats:p> We measure how cuts to public procurement propagate through the banking system in a financial crisis. During the European sovereign debt crisis, the Portuguese government cut procurement spending by 4.3 percent of GDP. We find that this cut saddled banks with nonperforming loans from government contractors, which led to a persistent reduction in credit supply to other firms. We estimate a bank-level elasticity of credit supply with respect to procurement demand of 2.5. In a general equilibrium model, our findings point to large effects of fiscal policy on credit supply and output in a crisis. (JEL E23, E44, E62, G01, G21, H57) </jats:p>",journal-article,6,115,6.2571483,8
,0022-3808,2022,Journal of Political Economy,"Are There Too Many Farms in the World? Labor Market Transaction Costs, Machine Capacities, and Optimal Farm Size","Foster, Andrew D.; Rosenzweig, Mark R.",10.1086/717890,https://doi.org/10.1086/717890,,journal-article,3,130,6.2316937,142
,0002-8282,2022,American Economic Review,"Offshore Profit Shifting and Aggregate Measurement: Balance of Payments, Foreign Investment, Productivity, and the Labor Share","Guvenen, Fatih; Mataloni, Raymond J.; Rassier, Dylan G.; Ruhl, Kim J.",10.1257/aer.20190285,https://doi.org/10.1257/aer.20190285,"<jats:p> We show how offshore profit shifting by US multinational enterprises affects several key measures of the US economy. Profits shifted out of the United States grew rapidly from the mid-1990s to 2010 and have since waned. From 1982–2016, on average, 38 percent of income attributed to US direct investment abroad is reattributable to the United States. We find that adjusting for profit shifting shrinks the trade deficit, decreases the return on US foreign direct investment abroad, boosts productivity growth rates in the late 1990s and early 2000s, and lowers labor’s share of income. (JEL E23, E25, F14, F23, H25, H87, L25) </jats:p>",journal-article,6,112,6.224831,66
,0002-8282,2025,American Economic Review,Firm Responses and Wage Effects of Foreign Demand Shocks with Fixed Labor Costs and Monopsony,"Dhyne, Emmanuel; Kikkawa, Ayumu Ken; Komatsu, Toshiaki; Mogstad, Magne; Tintelnot, Felix",10.1257/aer.20220948,https://doi.org/10.1257/aer.20220948,"<jats:p>We quantify the firm responses and real wage effects of foreign demand shocks. We use Belgian microdata to construct firm-specific measures of demand shocks, which capture that firms pass on foreign demand shocks to domestic suppliers. Our estimates of firm responses to these shocks suggest that firms face upward-sloping labor supply curves and have sizable fixed labor costs. We specify a general equilibrium model with these features to quantify the aggregate effects of simulated tariff shocks on wages. We find that ignoring fixed labor costs substantially underestimates aggregate effects on wages, whereas incorporating upward-sloping labor supply appears less consequential. (JEL D22, F13, F16, J22, J31, J42, L25)</jats:p>",journal-article,12,115,6.194911,2
,0022-3808,2024,Journal of Political Economy,Can Mentoring Alleviate Family Disadvantage in Adolescence? A Field Experiment to Improve Labor Market Prospects,"Resnjanskij, Sven; Ruhose, Jens; Wiederhold, Simon; Woessmann, Ludger; Wedel, Katharina",10.1086/726905,https://doi.org/10.1086/726905,,journal-article,3,132,6.1476183,28
,0034-6527,2022,The Review of Economic Studies,Are Marriage-Related Taxes and Social Security Benefits Holding Back Female Labour Supply?,"Borella, Margherita; De Nardi, Mariacristina; Yang, Fang",10.1093/restud/rdac018,https://doi.org/10.1093/restud/rdac018,"<jats:title>Abstract</jats:title>
                  <jats:p>In the US, both taxes and old-age social security benefits depend on one’s marital status and tend to reduce the labour supply of the secondary earner. To what extent are these provisions holding back the female labour supply? We estimate a rich dynamic life-cycle model of labour supply and savings for couples and singles using the Method of Simulated Moments for the 1945 and 1955 birth cohorts. Our model matches well the life-cycle profiles of labour market participation, hours, and savings for married and single people, and generates plausible elasticities of labour supply. It implies that eliminating these marriage-related provisions would drastically increase the participation of married women over their entire life cycle, reduce the participation of married men after age 60, and increase savings. If the resulting government surplus were used to lower income taxation, there would be large welfare gains for the vast majority of the population. These results hold for both cohorts, including the later one, which has participation similar to that of more recent generations.</jats:p>",journal-article,1,90,6.1292768,57
,0002-8282,2024,American Economic Review,Merchants of Death: The Effect of Credit Supply Shocks on Hospital Outcomes,"Aghamolla, Cyrus; Karaca-Mandic, Pinar; Li, Xuelin; Thakor, Richard T.",10.1257/aer.20221705,https://doi.org/10.1257/aer.20221705,"<jats:p> This study examines the link between credit supply and hospital health outcomes. We use bank stress tests as exogenous shocks to credit access for hospitals that have lending relationships with tested banks. We find that affected hospitals shift their operations to increase resource utilization following a negative credit shock but reduce the quality of their care to patients across a variety of measures, including a significant increase in risk-adjusted readmission and mortality rates. The results indicate that access to credit can affect the quality of health care hospitals deliver, pointing to important spillover effects of credit market frictions on health outcomes. (JEL G21, G32, I11, I18) </jats:p>",journal-article,11,114,6.0969486,32
,0012-9682,2025,Econometrica,The Social Tax: Redistributive Pressure and Labor Supply,"Carranza, Eliana; Donald, Aletheia; Grosset-Touba, Florian; Kaur, Supreet",10.3982/ecta21078,https://doi.org/10.3982/ecta21078,"<jats:p>In low‐income communities in both rich and poor countries, redistributive transfers within kin and social networks are frequent. Such arrangements may distort labor supply—acting as a “social tax” that dampens the incentive to work. We document that across countries, from the United States to Côte d'Ivoire, low‐income groups report strong pressure to share earned income with others; in addition, social groups that undertake more interpersonal transfers work fewer hours. Using a field experiment, we enable piece‐rate factory workers in Côte d'Ivoire to shield income using blocked savings accounts over 9 months. Workers may only deposit earnings increases, relative to baseline, mitigating income effects on labor supply. Offering Private accounts raises work attendance by 6.5% and earnings by 9.4%. These treatment effects are concentrated among workers who report higher redistributive pressure at baseline. To obtain further suggestive evidence on mechanisms, in a supplementary experiment, we vary whether blocked accounts are private or known to the worker's network. When accounts are private, take‐up is substantively higher (60% vs. 14%), with a resultant 8.8% higher earnings. Outgoing transfers do not decline, indicating no loss in redistribution. The welfare benefits of informal redistribution may come at a cost, depressing labor supply and productivity.</jats:p>",journal-article,6,93,6.096201,3
